park_code,price_type,cost,fee_type,pass_category,description,idpefo,fee,50.00,Commercial Entrance - Van,,"Capacity of 7 to 15 passengers - $50 (Vans).

If you are conducting an income generating tour of the park, you are subject to commercial tour fees. Fees for commercial vehicles are based on the capacity of the vehicle, not the number of passengers on board, and are valid for 7 days.",7F8A2EBF-0BC0-4BBF-86AA-48FE6E90166D
pefo,fee,60.00,Commercial Entrance - Mini-bus,,"Capacity of 16-25 passengers - $60

If you are conducting an income generating tour of the park, you are subject to commercial tour fees. Fees for commercial vehicles are based on the capacity of the vehicle, not the number of passengers on board, and are valid for 7 days.",BDAFC533-BF9B-4A4B-8525-37ECAC624173
pefo,fee,150.00,Commercial Entrance - Motor Coach,,"Capacity of 26+ passengers - $150 (Large tour buses, motorcoaches).

If you are conducting an income generating tour of the park, you are subject to commercial tour fees. Fees for commercial vehicles are based on the capacity of the vehicle, not the number of passengers on board, and are valid for 7 days.",33648BDB-A7A7-42DD-B49E-7DF8D35C8A90
pefo,fee,15.00,Entrance - Non-commercial Groups,,"Capacity of 16 or more $15/person.  Anyone that is 15 or younger is exempt from paying an entrance fee, in addition to anyone with a valid pass. A pass may cover immediate family members or up to 4 people traveling with the group.

A non-commercial organized group is a group traveling together, such as scouts, a club, a church, or other group that has organized its own itinerary. Fees are based on the capacity of the vehicle, not the number of passengers on board, and are valid for 7 days.",C745797E-459E-4AD5-8FF3-3171590F95E8
pefo,pass,45.00,,Annual Entrance - Park,"Come here often? Consider purchasing an annual pass. The park's annual pass costs $45 and is valid at Petrified Forest National Park. It admits the pass owner and all accompanying passengers in a single, private, non-commercial vehicle. The pass is available to purchase in the park at the entrance stations and is good for one year from the month of issue.",102E4716-2C80-4EC2-A6FA-430CFDAD7860
pevi,fee,10.00,Timed Entry Reservation - Location,,"On the day of your visit, purchase tickets and schedule a time to go up the Memorial to the observation deck.   Tickets are sold in the visitor center, daily 10 am to 5:45 pm. Adults,16 and older are $10. Children 15 and younger are free and must be accompanied by an adult.",5826ECDD-5644-4845-9828-FBED1B700E78
pevi,pass,35.00,,Annual Entrance - Park,"This pass is good for unlimited visits to Perry's Victory and International Peace Memorial. It is valid for 12 months from the date of purchase. With the signed pass in hand and personal identification, the pass-holder and 3 other adults (16 and older) are admitted to the observation deck for free.  On the day of each visit, all pass holders are required to show the pass to the fee ranger in the visitor center and schedule a specific time to ride the elevator.",63906A6F-11D1-4816-93D7-29338F209429
pinn,fee,30.00,Entrance - Private Vehicle,,This pass is valid for 1-7 days and includes everyone traveling in a single vehicle to Pinnacles East Entrance and West Entrance.,5FD4A1F4-7430-48B3-B89B-33855587BBB9
pinn,fee,25.00,Entrance - Motorcycle,,"This pass is valid for 1-7 days and includes everyone traveling on a motorcycle, scooter, or similar motorized vehicle to Pinnacles East Entrance and West Entrance.",48BBDD79-8D4F-49A2-BA86-A9D73E26A06A
pinn,fee,15.00,Entrance - Per Person,,This entry fee is for a single person traveling on foot or by bicycle.  It is valid for 1-7 days to Pinnacles East Entrance and West Entrance.,213B9B62-4C1F-4FC8-9393-552E8FCDAC13
pinn,fee,15.00,Entrance - Non-commercial Groups,,"Non-commercial groups traveling in vehicles that have a capacity of 16 passengers or more pay $15 per person up to the maximums listed for commercial groups with comparable passenger capacity ($40 or $100). People 15 years old or younger, anyone with a pass that may be used for park entry, and drivers hired for transportation only are exempt from the per person fee.",F7B31AAB-CC17-4B84-BE4E-119CB4C76D6F
pinn,fee,30.00,Commercial Entrance - Sedan,,"The charge for vehicles with a seating capacity of 1-6 passengers is $30. This entrance fee is for commercial tours of one or more people traveling on an itinerary that has been packaged, priced, or sold for leisure or recreational purposes by an organization that realizes financial gain through the provision of the service. Passenger ages or entrance passes do not affect the price.",4BFBB2A3-7932-4A9A-96E8-685A5788A053
pinn,fee,40.00,Commercial Entrance - Van,,"This entrance fee is for commercial tours of vehicles with a seating capacity of 7-15 people that has been packaged, priced, or sold for leisure or recreational puposes by an organization that realizes financial gain through the provision of the service. This fee is based on the seating capacity of the vehicle and not the actual number of passengers. Passengers ages or entrance passes do not affect the price.",DAD4C961-89BF-4B27-B138-D4F803454D5B
pinn,fee,40.00,Commercial Entrance - Mini-bus,,"This entrance fee is for commercial trous of vehicles with a seating capacity of 16-25 people that has been packaged, priced, or sold for leisure or recreational purposes by an organization that realizes financial gain through the provision of the sevice. This fee is based on the seating capacity of the vehicle and not the actual number of passengers. Passengers ages or entrance passes do not affect the price.",07DD8FF3-B640-4A44-9E06-B3F4C6BC928E
pinn,fee,100.00,Commercial Entrance - Motor Coach,,"This entrance fee is for commercial tours of vehicles with a seating capacity of 26 or more people that has been packaged, priced, or sold for leisure or recreational purposes by an organization that realizes financial gain through the provision of the service. This fee is based on the seating capacity of the vehicle and not the actual number of passengers. Passenger ages or entrance passes do not affect the price.",D9DBE99B-A2E2-4E86-90E8-DBAD807C1EF8
pinn,fee,0.00,Entrance - Education/Academic Groups,,"School groups and other academic institutions may qualify for an Educational Fee Waiver. If not qualified, please check fees for large or commercial groups.",42E3907C-21CC-4B1C-9D32-4E4116516EEA
pinn,pass,55.00,,Annual Entrance - Park,"This pass is valid for 12 months from the month of purchase. It covers the entrance fee to Pinnacles National Park for the pass signee and accompanying passengers entering in a single, non-commercial vehicle. Pinnacles Annual Passes are available at park entrance stations.",7C30CDF6-4056-459B-86EB-E9CCB601A544
piro,fee,25.00,Entrance - Private Vehicle,,This pass admits the driver and all passengers in a private-use vehicle for seven consecutive days to all areas of Pictured Rocks National Lakeshore. This fee does not cover additional fees associated with activities such as camping or commercial tours.,988878A2-BF4E-424F-993D-870C9D90DDFF
piro,fee,20.00,Entrance - Motorcycle,,This pass admits a motorcyclist and passenger (if applicable) to all areas of Pictured Rocks National Lakeshore for 7 consecutive days. This fee does not cover additional fees associated with activities such as camping or commercial tours.,531F000F-540B-438E-BC08-B8A58E062FF4
piro,fee,15.00,Entrance - Snowmobile,,This pass admits a snowmobile to all parts of Pictured Rocks National Lakeshore for 7 consecutive days. This fee does not cover additional fees associated with activities such as camping or commercial tours.,2240CC60-4298-45AD-AAC2-B9F05E519037
piro,fee,15.00,Entrance - Per Person,,"This pass admits one walk-in, bicycle-in, or boat-in person to all parts of Pictured Rocks National Lakeshore. This fee does not cover additional fees associated with activities such as camping or commercial tours.",588573B2-88EF-4424-BD28-AAF44BCD153D
piro,fee,25.00,Commercial Entrance - Sedan,,"This admits a commercial sedan to all areas of Pictured Rocks National Lakeshore. The flat rate for this pass is $25, plus an additional $5 per person age 16+. This fee does not cover additional fees associated with activities such as camping or commercial tours.",1FFAC568-7189-42A6-A513-895587DA9496
piro,fee,40.00,Commercial Entrance - Van,,"This pass admits a commercial van with a capacity of 7-16 persons, regardless of capacity, to all parts of Pictured Rocks National Lakeshore. This fee does not cover additional fees associated with activities such as camping or commercial tours.",A1ABAE65-548A-46A8-BF06-A45F246D5E8B
piro,fee,40.00,Commercial Entrance - Mini-bus,,This fee admits a commercial mini-bus to all parts of Pictured Rocks National Lakeshore. A mini-bus is defined as a vehicle with a 16-25 person capacity. The fee is charged regardless of occupancy of the vehicle. This fee does not cover additional fees associated with activities such as camping or commercial tours.,E7DE362F-1BD2-49F2-B76A-E35E2959726F
piro,fee,100.00,Commercial Entrance - Motor Coach,,"This fee applies to commercial vehicles with a 26+ person vehicle capacity, regardless of occupancy. This fee does not cover additional fees associated with activities such as camping or commercial tours.",A55DD800-7484-4E5B-912F-9F6C568C639C
piro,pass,45.00,,Annual Entrance - Park,"This annual pass is specific to Pictured Rocks National Lakeshore. It admits a driver and passengers in a private vehicle, or the cardholder plus three additional people to the park for 12 months from the purchase month. This pass does not cover other fees associated with activities such as camping or commercial tours.",587B797E-6527-4345-8D15-55A860411CCF
pisp,fee,10.00,Entrance - Per Person,,There is a $10 fee per person 16 years of age and older.  Children under 15 enter for free.  This fee includes a $3/person Tribal use fee to the Kaibab Band of Paiute Indians.  All Interagency Passes are accepted.,B624DBF8-597D-4403-A7DE-D93479BE1854
prwi,fee,20.00,Entrance - Private Vehicle,,Valid seven (7) consecutive days.,DF77B04A-3235-4710-B1D2-ED17471D6CD1
prwi,fee,15.00,Entrance - Motorcycle,,Valid seven (7) consecutive days.,F9ED929D-14B7-4A65-9570-210F191DD7B1
prwi,fee,10.00,Entrance - Per Person,,Valid seven (7) consecutive days.,4EBAA1B5-2282-4368-A23B-44DB0C442D84
prwi,pass,35.00,,Annual Entrance - Park,"The Prince William Forest Park annual pass provides unlimited entry to the park for one year through the month of purchase (example - a pass purchased on January 1, 2022 will be valid through January 31, 2023). The pass covers admission for the passholder (who must be present) and all individuals in a single vehicle, or for the passholder and three adults who walk into the park. The pass can be purchased at the visitor center or entrance station (when in operation).",828D4500-6C45-46B8-B2A4-2F20109D9518
puho,fee,20.00,Entrance - Private Vehicle,,"Admits one single, private, non-commercial vehicle and all of its passengers (up to 8 persons). Organized non-profit groups (service organizations, scouts, church groups, college/school clubs) are not eligible for the vehicle permit. Good for entry into Puʻuhonua o Hōnaunau National Historical Park for seven days from the date of purchase.",03E3A525-163C-4635-AA92-527EA1D5E7DC
puho,fee,15.00,Entrance - Motorcycle,,Admits one motorcycle. Good for entry into Puʻuhonua o Hōnaunau National Historical Park for seven days from the date of purchase.,2B712B8B-E949-4265-A75F-4E779D9046B8
puho,fee,10.00,Entrance - Per Person,,Admits one individual when entering by foot or bicycle. Good for entry into Puʻuhonua o Hōnaunau National Historical Park for seven days from the date of purchase. Individuals 15 years old and younger are admitted free of charge.,F654DF44-47E6-4DB9-A521-43EE8A4FE447
puho,fee,0.00,Entrance - Education/Academic Groups,,"Academic institutions may be eligible for a fee waiver by simply filling out sections 1, 2, and 5 of our educational fee waiver application. If an educational fee waiver is not obtained, the standard entrance fees apply.",2A5CFFCE-6FB7-406C-AA84-820A3BDAFFB5
puho,fee,10.00,Entrance - Non-commercial Groups,,Non-commercial groups entering the park in a bus or vehicle with a capacity of 16 persons or more will be charged $10.00 for each person on board.,DB29C309-5D42-4F84-A652-3EF82F77E26C
puho,fee,10.00,Commercial Entrance - Per Person,,All commercial tours that enter the park on a regular basis must have a Commercial Use Authorization (CUA) and are required to pay the commercial tour fee at the entrance station at each visit. For more information on how to get a CUA visit the Permits & Reservations page.,F91B295F-D695-4784-96A4-ABA85772957F
puho,pass,35.00,,Annual Entrance - Park,"Allows access for 12 months from date of purchase at Pu‘uhonua o Hōnaunau National Historical Park. The pass admits the pass owner and/or spouse along with accompanying persons in a single, private, non-commercial vehicle. When entry is by other means (bicycle, foot, Hele-On bus, etc.) the pass covers the purchaser and accompanying immediate family (spouse, children, and parents). Pass is not refundable or transferable.",EE69CCAA-BB8E-4D40-AFE8-C415D22A0965
puho,pass,55.00,,Annual Entrance - Park,"Hawai'i Tri-Park Annual Pass The annual pass is valid for entrance fees for pass holder and occupants of a single, private, non-commercial vehicle at Hawai'i Volcanoes National Park, Haleakalā National Park, and Puʻuhonua o Hōnaunau National Historical Park. The park is not responsible for misplaced, lost, or stolen cards. This pass does not cover camping fees and is non-transferable and non-refundable. Hawaiʻi Tri-Park Annual Pass can be purchased at the entrance station.",8CE2A72A-3CF3-4F01-AEC8-B4DAF99F4CBB
rigr,fee,30.00,Entrance - Private Vehicle,,"Entrance Fee to Big Bend National Park.
This fee includes all occupants of a private, non-commercial vehicle and is valid for 7 days",E07A124A-0B4E-4A9B-A2B5-4561826DE2AC
romo,fee,30.00,Entrance - Private Vehicle,,1-Day Vehicle Entrance Pass. This pass is valid for one private vehicle to enter RMNP for one day only. All passengers inside the vehicle are covered. Park entrance passes may be purchased in person at any of the park's entrance stations or in advance online at www.recreation.gov.,0FED94AF-B4CD-4E83-9699-B326254A76C2
romo,fee,35.00,Entrance - Private Vehicle,,7-Day Vehicle Entrance Pass. This vehicle entrance pass is valid for one vehicle to enter RMNP for 7 consecutive days. All passengers inside the vehicle are covered. Park entrance passes may be purchased in person at the any of the park's entrance stations or in advance online at www.recreation.gov.,16D2F4C6-D046-4C6D-BD5E-5972F33DEB88
romo,fee,15.00,Entrance - Per Person,,"1-Day Per Person Entrance Pass. This park entrance fee is for individuals, walk-ins, bicycles, and non-commercial groups to enter RMNP for 1-day only. Park entrance passes may be purchased in person at the any of the park's entrance stations or in advance online at www.recreation.gov.",2DBD99B9-98DA-47DF-8210-7193FD1E189B
romo,fee,25.00,Entrance - Motorcycle,,1-Day Motorcycle Entrance Pass. This pass is valid for one private motorcycle to enter RMNP for one day only. One pass is good for one motorcycle (including all riders). Park entrance passes may be purchased in person at the any of the park's entrance stations or in advance online at www.recreation.gov.,6C8D2C40-5678-4F12-8825-07DA79209B96
romo,fee,30.00,Entrance - Motorcycle,,7-Day Motorcycle Entrance Pass. This park entrance pass is valid for one motorcycle to enter RMNP for 7 consecutive days (including all riders). Park entrance passes may be purchased in person at the any of the park's entrance stations or in advance online at www.recreation.gov.,C31B9F3F-45E8-4DD7-BE69-D0F238807FF6
romo,fee,20.00,Entrance - Per Person,,"7-Day Per Person Entrance Pass. This park entrance fee is for individuals, walk-ins, bicycles, and non-commercial groups to enter RMNP for 7 consecutive days. Park entrance passes may be purchased in person at the any of the park's entrance stations or in advance online at www.recreation.gov.",DEC92F33-0288-4D7E-8D93-38840A13C6A6
romo,pass,70.00,,Annual Entrance - Park,RMNP Park-specific Annual Pass. This park pass is valid for entry to RMNP only for 1 year. One pass is good for one passholder and may be used in any personal vehicle. Park entrance passes may be purchased in person at the any of the park's entrance stations or in advance online at www.recreation.gov.,0206B10E-19F0-4A00-97DC-BA7537AA7D51
safr,fee,15.00,Entrance - Per Person,,"Credit/Debit cards preferred for payment.

Entrance to the ships is free for supervised children 15 years of age and younger.

$15 Individual Entry Pass - valid 1 through 7 days
Per person fee for visitors to the historic ships. Non-transferable. Valid for San Francisco Maritime National Historical Park.",C6353AAC-0ADE-4997-8A1A-DF0DD16F5C82
saga,fee,10.00,Entrance - Per Person,,Entrance fee to park grounds for people aged 16 and over. Kids aged 15 and younger are free. Valid for seven days. Fees collected 9am-4pm.,F0823FFA-1333-430E-8FC6-03E6348F0BF0
saga,pass,40.00,,Annual Entrance - Park,Valid for cardholder and up to three others when cardholder is present.,8320D9CB-1137-4C28-A391-B3A4AA245171
sagu,fee,25.00,Entrance - Private Vehicle,,"The vehicle entrance pass is sold in the form of a dated register receipt and admits one privately owned, non-commercial vehicle into Saguaro National Park. This includes passenger cars, trucks, vans, recreational vehicles, campers, or converted buses used for private, recreational purposes.",5AD0A145-53CF-4B72-91C0-D72253DFA52B
sagu,fee,15.00,Entrance - Per Person,,"Individuals entering the park by means other than a motor vehicle may purchase individual entrance passes. This includes hikers, horseback riders and bicyclists. The individual entrance fee is charged to anyone 16 years of age or older.",0017F3FC-94E1-42BA-A406-ACA24CCC493C
sagu,fee,20.00,Entrance - Motorcycle,,"This fee is charged per-vehicle upon entrance, regardless of the number of riders. An Annual Pass will cover two motorcycles traveling together if the two people who signed that pass are on different motorcycles. A Lifetime Pass (such as the Access or Senior Pass) with one signature line will only cover one motorcycle.",8851098E-BA01-4CA6-83DC-B1CA65383BBE
sagu,pass,45.00,,Annual Entrance - Park,"This pass covers up to 4 adults (anyone over the age of 16) or everyone in a single, non-commercial, vehicle. Is accepted in both districts of the park.",B3D0799F-8305-4573-8DBC-32A9B190AC85
sahi,fee,15.00,Timed Entry Reservation - Location,,Tickets for the Theodore Roosevelt House must be purchased in advance using Recreation.gov.  Adult tickets cost $15. Tickets for passholders and children 15 and under cost $1. All persons need a ticket to enter the Theodore Roosevelt House.,3891EBC7-266C-4B27-B8E2-79CE4C079B3B
sahi,pass,45.00,,Annual Entrance - Park,Pass covers guided tour of the Theodore Roosevelt House fees only at Sagamore Hill National Historic Site. Pass allows one passholder to print and sign their name and is valid for 12 months through the month of purchase. Pass covers the passholder and three additional adults (16 and over) when purchasing guide tour tickets of the Theodore Roosevelt House.,CBBD6E68-2B59-496B-9838-4EEBCF6C949F
saju,fee,10.00,Entrance - Per Person,,"Valid for 24 hours, valid for both fortifications",65649702-D539-4BF4-80C6-18F1117B7C54
seki,fee,35.00,Entrance - Private Vehicle,,This pass is valid for 1-7 days and includes everyone traveling in a single vehicle for Sequoia & Kings Canyon National Parks and Hume Lake District of Sequoia National Forest/Giant Sequoia National Monument.,0224B504-30C8-4A51-88EB-BFAF4A34AC3C
seki,fee,20.00,Entrance - Per Person,,This entry fee is for a single person traveling on foot or by bicycle. It is valid for 1-7 days in Sequoia & Kings Canyon National Parks and Hume Lake District of Sequoia National Forest/Giant Sequoia National Monument.,E2D2660F-3F49-4927-A985-289C84A1AE6E
seki,fee,30.00,Entrance - Motorcycle,,"This pass is valid for 1-7 days and includes everyone traveling on a motorcycle, scooter, or similar motorized vehicle for Sequoia & Kings Canyon National Parks and Hume Lake District of Sequoia National Forest/Giant Sequoia National Monument.",3F11D87F-2C9B-47C7-8F7A-4D38D3A10E64
seki,fee,20.00,Entrance - Non-commercial Groups,,"Non-commercial groups traveling in vehicles that have a capacity of up to 15 passengers pay a $35 vehicle entrance fee or use a park pass. Groups traveling in a bus or vehicle with a capacity of 16 persons or more are charged $20 per person, up to the maximums listed for commercial groups with comparable passenger capacity ($100 or $200). People 15 years old or younger, anyone with a pass that may be used for park entry, and drivers hired for transportation only are exempt from the per person fee.",14CF5CC8-26BE-4058-9496-9033F1D0D680
seki,fee,75.00,Commercial Entrance - Van,,"This entrance fee is for commercial tours of vehicles with a seating capacity of 7-15 people that has been packaged, priced, or sold for leisure or recreational purposes by an organization that realizes financial gain through the provision of the service. This fee is based on the seating capacity of the vehicle and not the actual number of passengers. Passenger ages or entrance passes do not affect the price.",C7E8BFCB-9ED2-4366-92E7-2B6AB0D5A4A9
seki,fee,100.00,Commercial Entrance - Mini-bus,,"This entrance fee is for commercial tours of vehicles with a seating capacity of 16-25 people that has been packaged, priced, or sold for leisure or recreational purposes by an organization that realizes financial gain through the provision of the service. This fee is based on the seating capacity of the vehicle and not the actual number of passengers. Passenger ages or entrance passes do not affect the price.",0FB4033A-6F44-46D7-8A5A-293FDD6A5CA5
seki,fee,200.00,Commercial Entrance - Motor Coach,,"This entrance fee is for commercial tours of vehicles with a seating capacity of 26 or more people that has been packaged, priced, or sold for leisure or recreational purposes by an organization that realizes financial gain through the provision of the service. This fee is based on the seating capacity of the vehicle and not the actual number of passengers. Passenger ages or entrance passes do not affect the price.",C3A31AA3-5865-4C77-BF48-5A250D1F14C9
seki,fee,25.00,Commercial Entrance - Sedan,,"The charge for vehicles with a seating capacity of 1-6 passengers is $25, plus $20 per passenger, with a maximum total fee of $75. This entrance fee is for commercial tours of one or more people traveling on an itinerary that has been packaged, priced, or sold for leisure or recreational purposes by an organization that realizes financial gain through the provision of the service. Passenger ages or entrance passes do not affect the price.",D4154484-401C-43B4-BA68-75BEE89CCFA6
seki,fee,20.00,Commercial Entrance - Per Person,,"The per person fee for vehicles with a seating capacity of 1-6 passengers is $20, plus $25 per vehicle, with a maximum total fee of $75. This entrance fee is for commercial tours of one or more people traveling on an itinerary that has been packaged, priced, or sold for leisure or recreational purposes by an organization that realizes financial gain through the provision of the service. Passenger ages or entrance passes do not affect the price.",090CB0E3-C1E7-443B-A666-56B93E0F392F
seki,pass,70.00,,Annual Entrance - Park,This pass is valid for Sequoia & Kings Canyon National Parks and Hume Lake Ranger District of Sequoia National Forest/Giant Sequoia National Monument for one year from the month of purchase. The pass admits all passengers in a private vehicle and is non-transferable.,43BA4917-F2C5-4B0D-99FB-B40BF356D2FE
shen,fee,30.00,Entrance - Private Vehicle,,"Unlimited entry for one vehicle and all passengers for seven consecutive days, beginning on the day of purchase. Vehicles must be private, noncommercial, and with a seating capacity of 15 or less.",18ABFF1C-DF99-4886-90B9-D7E638139B11
shen,fee,25.00,Entrance - Motorcycle,,"Entry for one motorcycle and one passenger for seven consecutive days, beginning on the day of purchase.",A0473B1B-2EAF-4468-B3D2-A97362ECB15D
shen,fee,15.00,Entrance - Per Person,,"Entry for walk-up or bicycling visitors, when 16 years of age or older (children under 16 are admitted for free). Includes entering the Park by all means other than a private, non-commercial vehicle. A family traveling together shall pay no more than the vehicle fee.",D9CEA578-7725-42EF-845B-1590D6F37D76
shen,fee,25.00,Commercial Entrance - Sedan,,The total cost is calculated: $25 + $10 per passenger.,3EAF7AF3-E4B5-4840-BF2B-74E1C0E6F22B
shen,fee,10.00,Commercial Entrance - Per Person,,This fee is for commercial use between 1-6 passengers (sedan). The total cost is calculated: $25 for the vehicle + $10 per passenger.,15A292F7-A194-4301-943F-7DEC0C35C8B9
shen,fee,75.00,Commercial Entrance - Van,,"Based upon the total capacity of a vehicle that can carry 7-15 passengers, regardless of the actual number of passengers.",F5EC6EE2-5B77-47B4-BE9A-796A9B1B64E8
shen,fee,100.00,Commercial Entrance - Mini-bus,,"Based upon the total capacity of a vehicle that can carry 16-25 passengers, regardless of the actual number of passengers.",C09EF461-CEA9-4EE0-A0F3-E34D184FCCF9
