park_code,price_type,cost,fee_type,pass_category,description,idjotr,fee,30.00,Entrance - Private Vehicle,,"7-day vehicle permit, admitting the passengers of a single, non-commercial vehicle on the day of purchase and for the next six days.",7B7735C8-93C7-4219-BF6C-50501E687F0B
jotr,fee,25.00,Entrance - Motorcycle,,"7-day entrance permit, per motorcycle.",92B7E52F-214E-4DB1-A1C4-9106A8154082
jotr,fee,15.00,Entrance - Per Person,,"7-day entrance fee, per person on foot or bike.",F6045D98-FDB9-47FC-AE27-67D3BFABCFB1
jotr,pass,55.00,,Annual Entrance - Park,"This pass is valid for 12 months from the month of purchase. It covers the entrance fee to Joshua Tree National Park for the pass signee and accompanying passengers entering in a single, non-commercial vehicle. Joshua Tree Annual Passes are available at park entrance stations and visitor centers.",A4891A96-80A2-4A55-850F-7D144AE57636
kemo,fee,5.00,Entrance - Private Vehicle,,"The Daily Pass is valid for the date of purchase only. It admits all persons traveling in a single, private, non-commercial vehicle (car/truck/van) and is non-transferable. This pass does NOT guarantee a parking spot.",9CA756E1-942C-4AC9-BC15-35B88133E7FD
kemo,fee,5.00,Entrance - Per Person,,The Daily Pass is valid for the date of purchase only. It admits all walk-in visitors aged 16 and older.,2FDB690A-9306-4D7D-99C7-1C0CA3E70CDE
kemo,fee,0.00,Entrance - Education/Academic Groups,,"To request an Academic Fee Waiver for your group, click on the link for further details.",9DADD29E-46D6-401D-98BD-BCA32CEDE732
kemo,fee,100.00,Commercial Entrance - Motor Coach,,$100 Motor Coach/Commercial Tour Groups with 26 or more people,F14FC13F-C2A0-4489-85A1-A9A59149B2F9
kemo,fee,40.00,Commercial Entrance - Mini-bus,,$40 per passenger bus with 16-25 people,EE0EB06E-1EB9-47C1-A8C3-5DB3C1A9155A
kemo,fee,25.00,Commercial Entrance - Sedan,,$25 per passenger bus/sedan with 1-6 people,BD27FE22-1AF4-4A6A-BBE3-B92046D0AA0F
kemo,pass,40.00,,Annual Entrance - Park,"The Annual Pass is valid for one year from the month of purchase. It admits all persons traveling in a single, private, non-commercial vehicle (car/truck/van) and is non-transferable. This pass does NOT guarantee a parking spot upon arrival.  This can be purchased online, in our Visitor Center, or at any of our 5 Automated Fee Machines located in our major parking lots. A valid debit/credit card will be needed as none of these locations accept cash.  ",9C1832CB-F716-4E41-8468-03586DF274B2
labe,fee,25.00,Entrance - Private Vehicle,,Park Entrance is $25 per vehicle and is good for 7 days.,447EB560-0AF8-456C-A4D5-D7C1C8C5A381
labe,fee,20.00,Entrance - Motorcycle,,Park entrance for motorcycles is $20 per motorcycles and is good for 7 days.,470FB97A-3246-434D-91B1-DC0081247531
labe,fee,15.00,Entrance - Per Person,,Park Entrance is $15 per person and is good for 7 days.,76E2CCBC-6F86-4315-89D0-FF6A0D643F9E
labe,pass,55.00,,Annual Entrance - Park,"Lava Beds National Monument, Crater Lake National Park, Lassen Volcanic National Park, and Whiskeytown National Recreation Area all share an annual pass. It is $55.00 and is valid for a year from the date of purchase.",A380447F-20D3-41EE-8DC5-F0755948A821
lake,fee,25.00,Entrance - Private Vehicle,,Admits a private non-commercial vehicle for 1-7 days.,463770EC-B211-4868-A2D8-8F6DCF405B0F
lake,fee,20.00,Entrance - Motorcycle,,Admits a motorcycle for 1-7 days.,75D8D248-1C20-44C4-AE53-0436C0DE57B2
lake,fee,15.00,Entrance - Per Person,,Admits a single individual walking/bicycling for 1-7 days.,37DB48E5-8600-4895-AED3-7A946722F59D
lake,fee,15.00,Entrance - Non-commercial Groups,,"Admits vehicles at the per person rate for groups using vehicles for 12 or more people. The $15 cost is per person ages 16+, not to exceed the flat rate paid commercial tours for same type of vehicle.",841290E6-07B4-4D10-AC78-0A4924876FF2
lake,fee,0.00,Entrance - Education/Academic Groups,,Admits education/academic groups as long as a fee waiver form is filled out and approved.,E61C8A1F-F4D2-48C6-923E-619C7A28F444
lake,fee,25.00,Commercial Entrance - Sedan,,Admits a sedan of 1-6 people.,C31533E0-6F3C-46E3-AA6C-06CC56CAA37A
lake,fee,50.00,Commercial Entrance - Van,,Admits a van of 7-16 persons.,47716249-1619-44E6-B474-0487DA53B67C
lake,fee,60.00,Commercial Entrance - Mini-bus,,Admits a mini-bus of 16-25 persons.,538EC6FB-8328-4A7C-98DD-65F9A53381C4
lake,fee,150.00,Commercial Entrance - Motor Coach,,Admits a motor coach of 26+ persons.,DD6C28E0-07CE-4964-BF05-B44F6C0B1BF5
lake,pass,45.00,,Annual Entrance - Park,"This pass admits the passholder only into Lake Mead National Recreation Area AND NOT other federal lands. The interagency passes allow access to more than 2,000 federal recreation sites.

Admits passholder and occupants of a single, private non-commercial vehicle. In cases where per person fees are charged, pass is valid for the passholder + 3 adults.1 year from month of purchase. Good through 1 year from month of purchase.",4F1A458A-B76F-42B5-A7FE-0CC5701162F0
lavo,fee,30.00,Entrance - Private Vehicle,,Valid for up to 7 consecutive days from the day of purchase at Lassen Volcanic National Park. Payable in-person at park entrances. Self-registration when not staffed.,AAF3A95A-CAEC-4577-8F7B-64EA6C50AF48
lavo,fee,10.00,Entrance - Private Vehicle,,Valid for up to 7 consecutive days at Lassen Volcanic National Park between December 1 and April 15. Payable in-person at park entrances. Self-registration when not staffed.,A4AA1995-171A-4583-8D8F-B6DFCD54FDF5
lavo,fee,25.00,Entrance - Motorcycle,,Valid for one motorcycle regardless of the amount of passengers. Valid for up to 7 consecutive days at Lassen Volcanic National Park. Payable in-person at park entrances. Self-registration when not staffed.,24A684E7-0212-4C5D-85A7-43F1B5C56885
lavo,fee,15.00,Entrance - Per Person,,"Per person entrance fee for one entry on foot, bicycle, or for individuals traveling together in a vehicle as a non-commercial, organized group. Valid for 7 consecutive days at Lassen Volcanic National Park. Payable in-person at park entrances. Self-registration when not staffed.",1508986E-10F4-4D21-8458-22762BAC3196
lavo,fee,0.00,Entrance - Education/Academic Groups,,"School groups are eligible for a fee waiver. Applicants must prove they are a bona fide academic institution, provide a written statement confirming that the visit supports a specific curriculum for which academic credit is offered, and provide a written statement identifying the park resources and/or facilities that will be used to support the educational purpose of the visit, and how they are relevant to that purpose.",8DE46916-169F-4092-A1AD-E6CF1F56A158
lavo,fee,25.00,Commercial Entrance - Sedan,,"Valid for up to 7 consecutive days for a vehicle carrying the same group of passengers. A commercial tour is defined as consisting of one or more persons traveling on an itinerary that has been packaged, priced, or sold for leisure or recreational purposes by an organization that realizes financial gain through the provision of the service. The entry fees are based upon the total seating capacity of vehicles regardless of the actual number of passengers. Annual or lifetime passes are not accepted.",94F7D440-D656-4179-BD04-13D175BFE950
lavo,fee,50.00,Commercial Entrance - Van,,"Valid for up to 7 consecutive days for a vehicle carrying the same group of passengers. A commercial tour is defined as consisting of one or more persons traveling on an itinerary that has been packaged, priced, or sold for leisure or recreational purposes by an organization that realizes financial gain through the provision of the service. The entry fees are based upon the total seating capacity of vehicles regardless of the actual number of passengers. Annual or lifetime passes are not accepted.",C3B1A130-7713-493C-A128-388AD1F746E9
lavo,fee,60.00,Commercial Entrance - Mini-bus,,"Valid for up to 7 consecutive days for a vehicle carrying the same group of passengers. A commercial tour is defined as consisting of one or more persons traveling on an itinerary that has been packaged, priced, or sold for leisure or recreational purposes by an organization that realizes financial gain through the provision of the service. The entry fees are based upon the total seating capacity of vehicles regardless of the actual number of passengers. Annual or lifetime passes are not accepted.",9B09502F-9F98-4AA9-BFA3-3A38B6A5C787
lavo,fee,150.00,Commercial Entrance - Motor Coach,,"Valid for up to 7 consecutive days for a vehicle carrying the same group of passengers. A commercial tour is defined as consisting of one or more persons traveling on an itinerary that has been packaged, priced, or sold for leisure or recreational purposes by an organization that realizes financial gain through the provision of the service. The entry fees are based upon the total seating capacity of vehicles regardless of the actual number of passengers. Annual or lifetime passes are not accepted.",E954212B-7E42-4696-8A93-62A78AAEBCCB
lavo,fee,10.00,Entrance - Motorcycle,,Valid for one motorcycle regardless of the amount of passengers. Valid for up to 7 consecutive days at Lassen Volcanic National Park. Payable in-person at park entrances. Self-registration when not staffed.,B2730F22-9ECD-4B4B-8339-D8DB1D38F680
lavo,fee,10.00,Entrance - Per Person,,"Per person entrance fee for one entry on foot, bicycle, or for individuals traveling together in a vehicle as a non-commercial, organized group. Valid for 7 consecutive days at Lassen Volcanic National Park. Payable in-person at park entrances. Self-registration when not staffed.",A462AD14-0C15-4D1B-A161-16BEF0291349
lavo,pass,55.00,,Annual Entrance - Park,"The Lassen Volcanic Annual Multi-Park Pass is valid for entrance fees at Lassen Volcanic National Park, Whiskeytown National Recreation Area, Crater Lake National Park, or Lava Beds National Monument.",8414036C-A80C-45A6-8E6D-B69D8CAC3237
lewi,fee,10.00,Entrance - Per Person,,Entrance fees are collected at the Fort Clatsop Visitor Center.,5294F683-43DB-497C-85B2-45FB4481EF02
lewi,pass,35.00,,Annual Entrance - Park,"The annual Oregon Coast Passport covers entry, vehicle parking, and day use fees at all Oregon state and federal fee sites along the Oregon Coast. Valid for 12 months.",5BBC3E83-71EE-4A44-9D9B-C15D78D0C4A8
libi,fee,25.00,Entrance - Private Vehicle,,Private non-commercial vehicle.,A8AF1A12-68EB-42D1-B186-AFBD8FA824D2
libi,fee,20.00,Entrance - Motorcycle,,one motorcycle and passenger,92577751-33E7-4971-9676-42F0EF82E25E
libi,fee,15.00,Entrance - Per Person,,Per person fee,B8AF38FF-BEDB-4ECE-99B8-AEB05AF57002
libi,fee,25.00,Commercial Entrance - Sedan,,"Commercial Rate for a vehicle holds up to 6 people, $25 plus per person.",B1063E45-46A6-4C3A-8258-215DF7D044A4
libi,fee,40.00,Commercial Entrance - Van,,Van holds up to 15 people,41C1C340-03FD-4643-861B-6387CDF5903D
libi,fee,40.00,Commercial Entrance - Mini-bus,,Commercial vehicle that holds up to 25 passengers,97C65975-9911-47C3-B7BC-EAF01B3FCC27
libi,fee,100.00,Commercial Entrance - Motor Coach,,"Commercial Bus $100.00 (26 or more seats, regardless of occupancy)",5882E85E-741A-4C37-9BCC-4E4815D1B360
loea,fee,30.00,Entrance - Per Person,,"The Museum is only accessible by guided tenement apartment tours or neighborhood walking tours and requires the purchase of the appropriate ticket.
The Tenement Museum Does Not Accept NPS Passes. 
As an affiliated National Park Service site the museum does not accept or sell National Park Passes, or any of the America the Beautiful—the National Parks and Federal Recreational Lands Passes.",C230C0D4-2038-4751-9E68-5F3A0572A489
meve,fee,30.00,Entrance - Private Vehicle,,This pass if good for 7 days.,715F0179-88F3-4D88-9CA7-5AA72E4C8C7D
meve,fee,25.00,Entrance - Motorcycle,,This pass is good for 7 days.,2EE88152-48B9-4528-86B1-B76D57074E74
meve,fee,15.00,Entrance - Per Person,,This pass is good for 7 days.,092975D7-27D4-4B5A-B330-06F42F6A7023
meve,fee,20.00,Entrance - Private Vehicle,,"Purchase digital park entrance passes on recreation.gov at no additional cost. Once purchased, passes for Mesa Verde National Park must be printed or saved on your mobile device prior to use. Connectivity is limited in the park, therefore printing the permit or saving it on your phone is highly recommended.

Passes, including the America the Beautiful, National Parks & Federal Recreational Lands Passes, such as the Annual, Access, or Senior pass may be purchased at the entrance station upon arrival.",197503FA-C674-4DC3-9615-95FE5E292665
meve,fee,15.00,Entrance - Per Person,,"Purchase digital park entrance passes on recreation.gov at no additional cost. Once purchased, passes for Mesa Verde National Park must be printed or saved on your mobile device prior to use. Connectivity is limited in the park, therefore printing the permit or saving it on your phone is highly recommended.

Passes, including the America the Beautiful, National Parks & Federal Recreational Lands Passes, such as the Annual, Access, or Senior pass may be purchased at the entrance station upon arrival.",1734DCA2-2100-4816-9DC4-878551F6B239
meve,fee,15.00,Entrance - Motorcycle,,This pass is good for 7 days.,0438E1AE-4372-428F-B9F6-0172B2C5E2EC
meve,pass,55.00,,Annual Entrance - Park,"Details: Fee good for a year, beginning from the date of sale.",ACDF366D-68C6-4F50-940B-D94EBB575AE0
moca,fee,10.00,Entrance - Per Person,,"This entrance fee covers one adult, aged 16 and over, for entrance to Montezuma Castle and Tuzigoot National Monuments for 7 days.",F5B7C788-B7FE-4279-B515-754E44A29BA3
moca,pass,35.00,,Annual Entrance - Park,"$35 annual pass, good for one (1) year.
Will cover the entrance fee at both Montezuma Castle and Tuzigoot National Monuments.
Available to everyone; good for card holder plus 3 adult guests.
Can be obtained in person at Montezuma Castle National Monument, Tuzigoot National Monument, or online at Recreation.gov.
Passes are NON-REFUNDABLE, NON-TRANSFERABLE, and cannot be replaced if lost or stolen.",7B8BB05E-D357-4838-BF85-9E11033C652C
mora,fee,30.00,Entrance - Private Vehicle,,"Grants unlimited entry for one vehicle and passengers for seven consecutive days. Vehicle must be private, noncommercial, and with a seating capacity of 15 or less.",F0F46C82-EBB1-46EB-B9A0-6838F948AD8F
mora,fee,15.00,Entrance - Per Person,,Walk-up or single bicycle fee. Grants unlimited entry for seven consecutive days.,2348183A-CA44-40A5-8A4F-091780B0A57B
mora,fee,25.00,Entrance - Motorcycle,,Grants unlimited entry for one motorcycle and passenger for seven consecutive days.,10D0A66C-7760-4C0A-B9B1-A07A6B806532
mora,fee,30.00,Commercial Entrance - Sedan,,"These fees are charged only to commercial organizations, such as tour companies. This fee is determined by the seating capacity of the vehicle. For sedan with 1 to 6 seats, the fee is $30 + $15 per client.",CFCE28F6-36D7-409C-99E5-7DF6133B9718
mora,fee,75.00,Commercial Entrance - Van,,"These fees are charged only to commercial organizations, such as tour companies. This fee is determined by the seating capacity of the vehicle.",594CB229-8B05-4EB7-99BD-60DE655841F6
mora,fee,100.00,Commercial Entrance - Mini-bus,,"These fees are charged only to commercial organizations, such as tour companies. This fee is determined by the seating capacity of the vehicle.",51EE0157-3124-4B33-A42E-3437ECE61EE5
mora,fee,200.00,Commercial Entrance - Motor Coach,,"These fees are charged only to commercial organizations, such as tour companies. This fee is determined by the seating capacity of the vehicle. NOTE: There are no current road restrictions for unmodified motor coaches of the standard length in the park. However, be aware that roads in the park are steep, narrow, and winding. In particular, it is recommended that RVs and vehicles with trailers longer than 25 feet LOA not travel up the Sunrise Road beyond the White River Campground intersection.",B2BE9588-0A67-4B43-9AE9-F7EACAF6AE80
mora,fee,2.00,Timed Entry Reservation - Location,,"A timed entry reservation is required from May 24-Sept 2, 2024, to enter the Paradise Corridor between 7:00 am-3:00 pm. The Paradise Corridor can be entered from both the Nisqually Entrance in the southwest corner of the park and the Stevens Canyon Entrance in the southeast via SR123.",1F1A9F94-D08C-45AC-BE7F-9470DA1AAF50
mora,fee,2.00,Timed Entry Reservation - Location,,"A timed entry reservation is required from July 4-Sept 2, 2024, to enter the Sunrise Corridor between 7:00 am-3:00 pm. The Sunrise Corridor can be entered from the White River Entrance in the northeast corner of the park via SR410.",F0553286-0A86-4FEC-91AE-128CDA1FA475
mora,pass,55.00,,Annual Entrance - Park,"Grants unlimited entry for one year to pass owner and passengers in a single, private, non-commercial vehicle. This pass does not cover camping fees and is non-transferable and non-refundable. If you already own a valid annual or lifetime pass (Interagency Senior, Annual, Military, etc) you do not need to purchase this pass. NOTE: The Discover Pass is for Washington State Parks only and does not cover Mount Rainier National Park.",7E0150A1-DC72-4D1E-BFB4-543F3C46175B
nabr,fee,20.00,Entrance - Private Vehicle,,"Entry fee admits one private, non-commercial vehicle driver and passengers. Entry fee is valid for 7 days.",7B692E3E-6A8F-4B3C-97E9-4DBC4EF520DB
nabr,fee,15.00,Entrance - Motorcycle,,"Entry fee admits one private, non-commercial motorcycle and its rider(s). Each motorcycle must purchase separate entry fee. Entry fee is valid for 7 days.",1A53A420-15FB-41D5-9799-6710091746AD
nabr,fee,10.00,Entrance - Per Person,,"Admits one individual with no car. This pass is typically used for bicyclists, and pedestrians. Youth 15 and under are admitted free. Entry fee is valid for 7 days.",05D12E53-A565-4810-ACFB-589A97BCEAC7
nabr,pass,55.00,,Annual Entrance - Park,"Valid for one year through the month of purchase. Admits one (1) private, non-commercial vehicle or its pass holder to Arches and Canyonlands national parks, and Natural Bridges and Hovenweep national monuments.",903CDD24-07E6-4B59-A332-7CA97ACC55D9
olym,fee,30.00,Entrance - Private Vehicle,,"Valid for seven consecutive days. Applies to private, non-commercial vehicles (15 passenger capacity or less). The pass covers all vehicle occupants.",7F32B472-2ECC-4620-B48A-ADE0F32D0305
olym,fee,25.00,Entrance - Motorcycle,,"Valid for seven consecutive days. Fee admits one individual on a private, non-commercial motorcycle.",6789F116-3E42-4663-B18E-F04B8CA957B3
olym,fee,15.00,Entrance - Per Person,,"Valid for seven consecutive days. This fee admits one person without a vehicle, including hikers, bicyclists, and pedestrians. Individuals fifteen years or younger are admitted free of charge.",3E764409-98D7-49D0-911E-78A807B8CC29
olym,fee,75.00,Commercial Entrance - Van,,"A commercial tour is defined as persons traveling on an itinerary that has been packaged, priced or sold for leisure recreational purposes by an organization that realizes financial gain through the provisions of the service.",2AB54561-6A11-4A9D-8813-A04FB5948D75
olym,fee,100.00,Commercial Entrance - Mini-bus,,"A commercial tour is defined as persons traveling on an itinerary that has been packaged, priced or sold for leisure recreational purposes by an organization that realizes financial gain through the provisions of the service.",62B0D3FA-20B0-4329-94B9-67CD3428529A
olym,fee,200.00,Commercial Entrance - Motor Coach,,"A commercial tour is defined as persons traveling on an itinerary that has been packaged, priced or sold for leisure recreational purposes by an organization that realizes financial gain through the provisions of the service.",85943FCD-4604-4891-9326-7C49F5AB2178
olym,pass,55.00,,Annual Entrance - Park,The Olympic National Park Annual Pass costs $55 and is good for entry into the park for one year from the month of purchase. Passes can be purchased at Olympic National Park visitor centers and entrance stations.,2A4E3071-0FE4-47BE-8BBA-2F5E53050B99
orpi,fee,25.00,Entrance - Private Vehicle,,This fee includes all occupants of a non-commercial vehicle.,2D6D186D-4AE8-4B6D-8579-C6EC451CB0CE
orpi,fee,20.00,Entrance - Motorcycle,,"Motorcycle: $20 
Admits one single, private, non-commercial motorcycle and its passenger(s).",CB2F0500-222D-4331-A054-DB500FF00A19
orpi,fee,15.00,Entrance - Per Person,,"Individuals: $15
This fee applies to bicycles and walk-ins (per person)",D157F075-9104-453F-9C7C-8D114BC076FB
orpi,pass,45.00,,Annual Entrance - Park,Good for one year at Organ Pipe Cactus National Monument for a standard vehicle. Online purchase on Recreation.gov only.,4C46E2B3-83C4-4EF5-984F-EB5023DC653C
pais,fee,25.00,Commercial Entrance - Sedan,,Pass is valid for the day of purchase and the next six days for a vehicle carrying the same group of passengers. The entry fees of commercial tours are based upon the total capacity of vehicles that can carry seven or more passengers regardless of the actual number of passengers.,9FFF96E3-6E85-4B69-8B5C-B757909A20E3
pais,fee,40.00,Commercial Entrance - Van,,Pass is valid for the day of purchase and the next six days for a vehicle carrying the same group of passengers. The entry fees of commercial tours are based upon the total capacity of vehicles that can carry seven or more passengers regardless of the actual number of passengers.,81A8FAC8-22D3-42C9-918C-521F1B9F444E
pais,fee,40.00,Commercial Entrance - Mini-bus,,Pass is valid for the day of purchase and the next six days for a vehicle carrying the same group of passengers. The entry fees of commercial tours are based upon the total capacity of vehicles that can carry seven or more passengers regardless of the actual number of passengers.,7EB423B1-0F53-40F2-89DA-8AEC4DD03AF5
pais,fee,100.00,Commercial Entrance - Motor Coach,,Pass is valid for the day of purchase and the next six days for a vehicle carrying the same group of passengers. The entry fees of commercial tours are based upon the total capacity of vehicles that can carry seven or more passengers regardless of the actual number of passengers.,C93C950B-0946-4DC1-8773-609FA5E4429E
pais,fee,25.00,Entrance - Private Vehicle,,"Admits the passholder and up to 15 passengers in the same private (non-commercial) vehicle. It expires one week from the date of purchase. For private vehicles, this entrance pass is required for overnight camping. 

A 1-day entrance pass is available for $10 per vehicle. 1-day entrance passes expire at midnight on the date of purchase and are not valid for overnight camping.",4DE57A61-07FD-45EC-9150-554DF5B54CC7
pais,fee,20.00,Entrance - Motorcycle,,"Admits the passholder and passenger of one motorcycle. It expires one week from the date of purchase. For motorcyclists, this entrance pass is required for overnight camping.

A 1-day entrance pass is available for $5 per motorcycle. 1-day entrance passes expire at midnight on the date of purchase and are not valid for overnight camping.",0A188D3E-BDDE-4A62-B874-07CBC38BBE3E
pais,fee,15.00,Entrance - Per Person,,"Admits one individual bicyclist, hiker, or pedestrian visiting the facility without a private vehicle. An individual pass is not required for visitors aged 15 and under. It expires one week from the date of purchase. For an individual, this entrance pass is required for overnight camping. 

A 1-day entrance pass is available for $5 per person. 1-day entrance passes expire at midnight on the date of purchase and are not valid for overnight camping.",CFDD4B80-EF49-4117-BB34-B6148E59B74C
pais,fee,15.00,Entrance - Non-commercial Groups,,Non-commercial groups traveling in a vehicle with a capacity of 16 persons or more are charged per person. This entrance pass is valid for one week from the date of purchase. Fees will not exceed the commercial fee for the same-sized vehicle. Youth 15 and younger are free. Individuals or families with any valid Annual or Lifetime pass may use their pass for entry.,F1992299-204D-4DAA-8167-3F845C6732B3
pais,pass,45.00,,Annual Entrance - Park,Admits the passholder and up to 15 passengers in the same private (non-commercial) vehicle or motorcycle. It expires one year from the month of purchase.,A7CA3ACE-94B9-40C0-A8FE-7DB822192BA8
pefo,fee,25.00,Entrance - Private Vehicle,,"Admits one private, non-commercial vehicle (15-passenger capacity or less) and all occupants. Valid for 7 days.",7CFAFE03-B790-42AB-AAAC-AB6DCD9AF2FA
pefo,fee,15.00,Entrance - Per Person,,"Admits one individual with no motor vehicle (bicyclist, hiker, pedestrian). Youth 15 and under are admitted free of charge. Valid for 7 days.",E67095D3-4E07-4479-8A48-95DA46B5289D
pefo,fee,20.00,Entrance - Motorcycle,,"Admits one or two passengers on a single private, non-commercial motorcycle. Valid for 7 days.",2E9747F0-9248-4E83-88C8-99BCFB75B003
pefo,fee,25.00,Commercial Entrance - Sedan,,"$25 flat fee + $10 per person (Sedans, SUVs, Minivans)

If you are conducting an income generating tour of the park, you are subject to commercial tour fees. Fees for commercial vehicles are based on the capacity of the vehicle, not the number of passengers on board, and are valid for 7 days.",9A8338BC-CC64-4FEB-BDE7-3A1569A303E2
pefo,fee,10.00,Commercial Entrance - Per Person,,"$25 flat fee + $10 per person (Sedans, SUVs, Minivans)

If you are conducting an income generating tour of the park, you are subject to commercial tour fees. Fees for commercial vehicles are based on the capacity of the vehicle, not the number of passengers on board, and are valid for 7 days.",07E4730C-AF6D-4864-BFF7-4A0B3596E4B5
